{"capabilities":["depth.truedepth","depth.truedepth.30","tracking.arkit-face"],"clock":{"session_domain":"d0.host","units":"ns"},"coord_conventions":{"camera":"opencv","matrix_layout":"row-major-16","pixel_center":"0.5","pose":"world-to-camera","quaternion":"xyzw","units":"m"},"derived_from":null,"devices":[{"clock":{"domain":"d0.host","to_session":{"drift_ppm":0,"method":"identity","offset_ns":0,"residual_ns":0}},"id":"d0","model":"synthetic","role":"primary"}],"duration_s":4.2,"format":"prsncap","person_ref":"urn:uuid:00000000-0000-4000-8000-000000000001","phases":[{"ended_ns":259201100002999,"id":"setup","mode":"avf","started_ns":259201000003000},{"ended_ns":259204133336332,"id":"orbit","mode":"avf","started_ns":259204000003000},{"ended_ns":259205033336334,"id":"expr","mode":"arkit","started_ns":259205000003000}],"qc":{"live_flags":0,"retakes":[{"count":1,"phase":"orbit"}]},"script":{"id":"example-depth-minimal","kind":"full","version":"1.0.0"},"session_id":"urn:uuid:00000000-0000-4000-8000-0000000000c4","started":"2026-10-02T18:04:11.204Z","streams":[{"dtype":"float16","filtered":false,"fps_nominal":30,"h":20,"id":"d0/depth.front","kind":"depth","native_kind":"disparity","sensor":"truedepth","units":"1/m","w":8},{"fps_nominal":60,"id":"d0/tracking.arkit","kind":"tracking"}],"tier":"archival","version":1}